event_id,event_date,event_time,event_location,event_item_id,agenda_number,agenda_sequence,matter_file,matter_name,matter_title,matter_type,matter_type_name,matter_status,matter_status_name,matter_intro_date,matter_passed_date,matter_enactment_date,matter_enactment_number,matter_requester,matter_body_name,title,action,action_text,passed,vote_type,consent,tally,mover,seconder,roll_call_flag,agenda_link,minutes_link,video_link,attachment_links,Agenda_item_fulltext,source,notice_date,sponsor,cosponsors,student_votes,Monica Garcia,Jackie Goldberg,Kelly Gonez,George McKenna III,Nick Melvoin,Tanya Ortiz Franklin,Scott Schmerelson,Superintendent
FM-2022-06-14,2022-06-14,,LAUSD Board Room,FM-032-21/22,032-21/22,1,Res-032-21/22,,"Investing and Strengthening Social Emotional Learning Competencies and Practices Across Los Angeles Unified for College, Career and Beyond (Res-032-21/22)",Resolution,Resolution,Adopted as Amended,Adopted as Amended,2022-05-10,2022-06-14,,,,Board of Education,"Investing and Strengthening Social Emotional Learning Competencies and Practices Across Los Angeles Unified for College, Career and Beyond (Res-032-21/22)",Adopted as Amended,,1,Roll Call,0,Ayes: 4; Absent: 1; Abstain: 2,Kelly Gonez,Tanya Ortiz Franklin,1,,,https://lausd.granicus.com/MediaPlayer.php?view_id=4&clip_id=4048,,"Whereas, Social Emotional Learning (SEL) is the process through which young people and adults acquire and apply the knowledge, skills, and attitudes to develop healthy identities, manage emotions and achieve personal and collective goals, feel and show empathy for others, establish and maintain supportive relationships, and make responsible and caring decisions; Whereas, SEL has been shown to strengthen academic outcomes (Durak et al., 2011), improve students’ well-being (Taylor et al., 2017), and increase post-secondary success (Jones, Greenburg, & Crowley, 2015); Whereas, Recognizing the importance of addressing the needs of the whole child, the Governing Board of the Los Angeles Unified School District established SEL as one of its priority areas, as outlined in its 2021 Board Goals; andWhereas, The Board Goal stated, “The percentage of students in transitional years (Kindergarten, 5th, 6th, 8th, 10th, and 12th grade) demonstrating mastery in the social emotional competency areas of growth mindset, self-efficacy, self- management and social awareness as demonstrated by a portfolio rubric will increase from the June 2022 baseline by 50% by June 2026”; now, therefore be itResolved, That the Governing Board of the Los Angeles Unified School District hereby recognizes SEL as an integral part of education, allowing students to thrive both academically and personally, and as essential competencies for college, career and lifelong success; Resolved further, That the Board hereby directs the Superintendent to supplement the District’s Strategic Plan with a SEL Roadmap, inclusive of milestones and metrics to evaluate progress towards the adoption and implementation of Districtwide SEL competencies and standards, which includes:·	A Districtwide strategy for the adoption and integration of SEL competencies for all students, which may include: o	A process and timeline for the selection and development of district SEL standards, rooted in the Collaborative for Academic, Social, and Emotional Learning (CASEL) framework and five competencies, that are comprehensive, developmentally appropriate, culturally relevant, and vertically alignedo	A resource and program inventory of all practices and policies that affect students’ experience in schools, including a multi-tiered continuum of academic and positive behavioral instruction and support that the District offers and the opportunities to embed SEL practices and competencies ·	Supports for teachers, administrators, and staff in their teaching and implementation of the SEL standards, which may include: o	Robust, universal professional development for all certificated school-based staff in the SEL competencies and the corresponding learning standards as part of the regular District-required professional development offerings, including the New Teachers’ Institute that focuses on teaching practices and strategies that are developmentally appropriate, culturally responsive and can be incorporated into other content areas o	Updating all curriculum maps and learning targets for core subjects with the integrated Districtwide SEL competencies by the 2023-24 school yearo	The incorporation of the SEL competencies and standards into the Teaching and Learning framework, as appropriate, by the 2024-25 school yearo	The development of an SEL micro-credential offering and curriculum for educatorso	Opportunities for classified staff members to engage in learning opportunities to support the socio-emotional development of students·	Supports for students in their learning and development of SEL competencies, which may include:o	Prioritizing student voice as part of the development of the District’s roadmap, including ways to elevate their ideas, as well as refine programs and practices to reflect the student experienceo	The development of peer mentoring programs for secondary students where students can foster and cultivate the five core competencies of SEL and overall health and wellness. ·	Supports for Parents, Families, and Caregivers, which may include: o	Of the annual required Parent Center workshop offerings, at least one workshop for families focused on supporting SEL at home, including providing resources that can help support families with the Districtwide SEL competencies and standards; and, be it finally Resolved, That the District shall revise the School Experience Survey questions to align towards Districtwide SEL competencies and help improve the monitoring of the District’s SEL standards, to be adopted by the upcoming 2023-24 school year.",FileMaker Resolutions DB,2022-05-10,Kelly Gonez,Scott Schmerelson; Jackie Goldberg; Tanya Ortiz Franklin,Parishi Kanuga: Yes,Yes,Absent,Yes,Abstain,Yes,Yes,Abstain,
FM-2022-05-10,2022-05-10,,LAUSD Board Room,FM-027-21/22,027-21/22,2,Res-027-21/22,,"Celebrating Los Angeles Unified School District’s Classified Employees’ Service, Skill and Long-Standing Commitment to Our Communities",Resolution,Resolution,Adopted,Adopted,2022-04-05,2022-05-10,,,,Board of Education,"Celebrating Los Angeles Unified School District’s Classified Employees’ Service, Skill and Long-Standing Commitment to Our Communities",Adopted,,1,Roll Call,0,Ayes: 7,Monica Garcia,Kelly Gonez,1,,,https://lausd.granicus.com/MediaPlayer.php?view_id=4&clip_id=4020,,"Whereas, The Los Angeles Unified School District recognizes the over 32,000 classified employees who are dedicated in their service to public education and a vital part of the District;Whereas, Classified employees play a key role in supporting students’ academic success by assisting over 400,000 students inside and outside of the classroom in grades ETK-12, more than 22,000 students in Early Education programs and, more than 20,000 students accomplishing their career goals in Adult and Career Education Centers;Whereas, Classified employees are essential to the District’s operations providing daily service to the students, faculty, staff and families through their hard work as school employees, including clerical and technical employees, as well as bus drivers, instructional aides, library aides, paraeducators, special education assistants, library and media assistants, food service providers, security officers, computer services maintenance workers and others; Whereas, Labor partners including Service Employees International Union (SEIU) Local 99, Teamsters Local 572, California School Employee Association (CSEA) Chapter 500, Los Angeles/Orange Counties Building and Construction Trades Council, Associated Administrators of Los Angeles (AALA), Los Angeles School Police Association (LASPA) and the Los Angeles School Police Management Association (LASPMA) represent classified employees who work tirelessly to serve students and ensure a supportive, clean, safe and comfortable learning environment for both the students and faculty of the District;Whereas, During the regular academic year classified employees in the District safely transport approximately 41,000 students to and from school each day by bus; serve over 720,000 meals to students each day (including 400,000 breakfasts, 350,000 lunches, and 80,000 supper and snack meals per day); create and sustain a learning environment with clean and operational facilities and classrooms, and maintain an inviting landscape at more than 1,000 District schools and other facilities that students, parents, and the community can be proud of;Whereas, Classified employees were an integral part of the District’s landmark response to the COVID-19 pandemic and its impact on the families the District proudly serves. Since the start of the pandemic, Classified Employees served over 132 million meals at our Grab-and-Go Centers, routinely clean and sanitize schools and offices allowing for the adherence to essential safety protocols, distributed hundreds of thousands of devices and hotspots to students and families for distance learning, supported the administration of over 14.7 million COVID-19 tests and the distribution of over 120,000 vaccines as of March 2022;Whereas, In 1986, the California State Legislature decreed the third full week of May each year as Classified School Employee Week in official recognition of classified school employees, by passage of Senate Bill 1552 (Campbell); now, therefore be itResolved, That the Governing Board of the Los Angeles Unified School District hereby declares the week of May 15 – 21, 2022 as Classified School Employee Week in the District and encourages the celebration of classified school employees at our schools and throughout the District for their hard work and unwavering dedication to our students, families, and schools and the invaluable contributions they make to our educational community; and, be it finallyResolved, That the Board hereby recognizes and greatly appreciates the contributions and dedicated service of classified professionals to quality education in the District and the State of California.",FileMaker Resolutions DB,2022-04-05,Kelly Gonez,Monica Garcia; Jackie Goldberg; George McKenna III; Nick Melvoin; Tanya Ortiz Franklin; Scott Schmerelson,Parishi Kanuga: Yes,Yes,Yes,Yes,Yes,Yes,Yes,Yes,
FM-2022-05-10,2022-05-10,,LAUSD Board Room,FM-028-21/22,028-21/22,3,Res-028-21/22,,Arts Justice: Access and Equity Across the Disciplines and the District,Resolution,Resolution,Adopted,Adopted,2022-04-05,2022-05-10,,,,Board of Education,Arts Justice: Access and Equity Across the Disciplines and the District,Adopted,,1,Roll Call,0,Ayes: 6; Abstain: 1,Tanya Ortiz Franklin,Kelly Gonez,1,,,https://lausd.granicus.com/MediaPlayer.php?view_id=4&clip_id=4020,,"Whereas, On June 22, 2021 the Governing Board of the Los Angeles Unified School District adopted four Board Goals committing the Los Angeles Unified School District to improve student achievement in post-secondary preparation, literacy, numeracy, and social-emotional wellness; Whereas, Participating in arts education promotes creativity, wellness, healing and socio-emotional learning, which are foundational skills to achieving the Board goals; Whereas, California Education Code sections 51210 and 51220 provide that California schools must provide a course of study for students in grades 1 through 12 with courses or instruction in visual and performing arts, including dance, music, theater, and visual arts, aimed at the development of aesthetic appreciation and the skills of creative expression; Whereas, The State of California recognizes the arts as an integral part of a quality education by requiring the completion of a visual and performing arts (VAPA) course for students wishing to pursue higher education in California’s four-year public colleges; Whereas, Education Code 49011 requires that no pupil enrolled in a public school shall be required to pay to participate in an educational activity and students have the right to access all educational materials for extracurriculars or classes including but not limited to instruments, arts supplies or dance/cheer uniforms; Whereas, The California Arts Content Standards for Public Schools, Prekindergarten through Grade 12: Dance, Media Arts, Music, Theatre, Visual Arts, was adopted by the State Board of Education on January 9, 2019, to foster students’ artistic competencies; cultivate their appreciation and understanding of the arts in ways that are enjoyable, fulfilling, and transferable to personal, academic, and professional endeavors; and support them to fully engage in lifelong arts learning;Whereas, The California Arts Education Framework for Public Schools, Transitional Kindergarten Through Grade Twelve (Arts Framework) was adopted by the State Board of Education on July 8, 2020 to provide guidance for educational programs on how to implement standards based arts education. Whereas, Since 1980 the Board has adopted over 10 Board Resolutions committed to strengthening arts access and programming at the local and state levels, including in a 2012 resolution entitled, “Supporting Educational Equity, Student Achievement and Mastery of 21st Century Skills through Arts at the Core” affirming the arts as a part of core academic instruction, including direct and integrated instruction; Whereas, In 2013, the Board passed a resolution entitled, “Arts at the Core: Implementing the Arts Education and Creative Network Plan,” which called on the Superintendent to develop a plan to distribute and support the use of state and federal guidelines to administrators and school site stakeholders, integrate comprehensive arts education and arts teaching and learning, collect and disseminate data to ensure accurate and transparent information regarding equitable access to arts education, and develop budget ideas to significantly increase funding for arts education; Whereas, In 2015, the Arts Education Branch created the Arts Equity Index to assess arts programming across all schools and to help inform how K-12 arts personnel and resources are administered; Whereas, The County of Los Angeles Board of Supervisors adopted the new Los Angeles County Regional Blueprint for Arts Education on October 13, 2020, which sets forth a vision, policy, and guide for increasing equity and access in arts education for all young people across Los Angeles County, prioritizing those who have been historically excluded from learning in the arts, both in schools and in communities; Whereas, Research documents the benefits of an arts education including developed critical thinking, problem-solving, imagination, creativity, alternative ways to communicate ideas, self-esteem, empathy, academic and personal success, and students from low-income backgrounds with high access to arts in school are more likely to graduate, more likely to finish college, and register to vote than students without access to arts; Whereas, The COVID-19 pandemic significantly impacted our school communities and students’ mental health and the arts have the potential to heal trauma and decrease stress and anxiety; Whereas, An equitable Path to Recovery requires providing additional resources to our high and highest need schools including ensuring that students have access to comprehensive and rigorous coursework including arts education, now, therefore be itResolved, That the Governing Board of the Los Angeles Unified School District, as part of a comprehensive approach to achieve the Board Goals, to achieve the goals of the California State Arts Content Standards, and to meet the requirements set forth in California Education Codes 51210 and 51220, commits to equitable access to high quality, standards-based, comprehensive, sequential,culturally relevant and developmentally appropriate arts education across disciplines to all PK-12 students regardless of race, ethnicity, country of origin, family income, neighborhood of residence, gender, gender identity, disability, sexual orientation, and any other axis of historical oppression; Resolved further, That the Superintendent will analyze and respond to gaps in access to arts programming, reporting back to the Board and public within 120 days and annually with information such as: 1. What percentage of students meaningfully participate in each of the five arts disciplines (visual arts, music, dance, theater, and media arts), at least once during the instructional day disaggregated by grade level (including early education, elementary, middle and high school), and by race/ethnicity, disability, and/or language? 2. What percentage of students are in which types of programs (e.g. elective course, 9-week program, semester-long, year-long, after school extracurricular program, magnet school, in-school partnership with an external organization, or no program)? 3. How are these arts disciplines and programs funded and made available to schools (e.g. central allocation, Community of Schools (COSA) funded, school site funded, parent organization or booster club funded, community organization donation, and funding from the Arts Equity Index)? 4. How is the Arts Equity Index currently used to guide equitable investments in Arts Education? (e.g. which schools get additional funding, how much funding is allocated through the index annually etc.) 5. What are the gaps in arts education enrollment, including student-teacher ratios and arts partnerships, across SENI quintiles, Local District, Community of School, Board District, race/ethnicity, disability and/or language? How and when will these gaps be closed? 6. How equitable is access to arts facilities and equipment across schools and programs (e.g. design, renovation, construction)? What do programs have and/or need to achieve equity? 7. Potential additions or revisions to the school experience survey or other open data-collection sources to regularly review and respond to access and equity in arts education; and, be it finally Resolved, That the Los Angeles Unified School District will intentionally build and strengthen the quality and quantity of arts education, through collaborative efforts that may include: 1.	Planning to fill the gaps in current arts programming so that every student PK- 12 has an equitable opportunity to access and experience robust, comprehensive, and sequential standards-based arts instruction and courses in each of the arts disciplines during the instructional day at every grade level by ensuring a baseline of core instructional services of arts education;2.	Creating Community of Schools arts pathways to create a sequential and cohesive arts curriculum across grade levels; 3. 	Providing additional arts opportunities through supplemental school-site partnerships with arts education organizations and institutions, making publicly available a database of partners (including what services they provide, in which arts discipline(s) and which schools they partner with); 4.	Ensuring a PK-12 curriculum and pedagogy that is culturally responsive, trauma- and resiliency- informed, and inclusive for all students across identities, skills, disabilities and learning differences; and 5. 	Establishing an arts advisory council, composed of at least seven students enrolled in 6-12th grades across all Board Districts, credentialed educators across all five arts disciplines and grade spans, and relevant arts-focused partners, to analyze data gathered, inform decision making, and provide an annual update to the Board on Arts Justice progress based on qualitative and quantitative student data.",FileMaker Resolutions DB,2022-04-05,Tanya Ortiz Franklin,Nick Melvoin; Monica Garcia; Jackie Goldberg; Scott Schmerelson; Kelly Gonez,Parishi Kanuga: Yes,Yes,Yes,Yes,Abstain,Yes,Yes,Yes,
