{
  "metadata": {
    "municipality": "LAUSD",
    "quarter": "Q1 2020",
    "date_range": "2020-01-01 to 2020-03-31",
    "source": "Granicus Video Archives",
    "source_urls": {
      "view_publisher_v4": "https://lausd.granicus.com/ViewPublisher.php?view_id=4",
      "view_publisher_v2": "https://lausd.granicus.com/ViewPublisher.php?view_id=2",
      "rss_agendas_v4": "https://lausd.granicus.com/ViewPublisherRSS.php?view_id=4&mode=agendas",
      "rss_vpodcast_v4": "https://lausd.granicus.com/ViewPublisherRSS.php?view_id=4&mode=vpodcast"
    },
    "extraction_date": "2026-02-12",
    "extraction_method": "Scraped ViewPublisher.php?view_id=4 (committee meetings listed) + probed individual clip_ids via MediaPlayer.php for Regular/Special Board Meetings not shown in ViewPublisher index",
    "notes": [
      "RSS feeds only contain ~100 most recent entries (back to Sep 2024); not useful for 2020 data",
      "ViewPublisher view_id=4 lists committee meetings with durations; Regular/Special Board Meetings found by probing sequential clip_ids",
      "ViewPublisher view_id=2 only goes back to Aug 2023; no 2020 data",
      "view_id=3 returns 403; view_id=1 and view_id=5 return 404",
      "LAUSD posts bilingual (English/Spanish) paired entries for recent meetings, but Q1 2020 entries are English-only",
      "Some clip_ids return HTTP 403 (restricted/closed session content) or 404 (nonexistent)",
      "COVID-19 pandemic disrupted meetings starting mid-March 2020; emergency meetings called Mar 10 and Mar 13",
      "clip_id 3606 is inferred as Feb 18 Regular Board Meeting afternoon session based on chronological position between clip 3605 (Feb 18 morning) and 3607 (Feb 20)"
    ],
    "total_meetings_found": 27,
    "total_accessible_meetings": 25,
    "total_restricted_meetings": 2,
    "clip_id_range_probed": "3588-3639"
  },
  "meetings": [
    {
      "clip_id": 3589,
      "title": "Special Education Committee",
      "date": "2020-01-09",
      "time": null,
      "duration_seconds": 5352,
      "duration_display": "1h 29m",
      "meeting_type": "Committee",
      "committee_name": "Special Education Committee",
      "is_closed_session": false,
      "language": "English",
      "has_spanish_pair": false,
      "spanish_clip_id": null,
      "agenda_url": "https://lausd.granicus.com/AgendaViewer.php?view_id=4&clip_id=3589",
      "video_url": "https://lausd.granicus.com/MediaPlayer.php?view_id=4&clip_id=3589",
      "video_download_url": "https://lausd.granicus.com/DownloadFile.php?view_id=4&clip_id=3589",
      "status": "accessible",
      "agenda_items_noted": [
        "Welcome and Introductions",
        "Community Advisory Committee Updates",
        "Special Education Compliance Update",
        "Multi-Tiered System of Support (MTSS)",
        "Public Comment",
        "Closing Remarks",
        "Adjournment"
      ]
    },
    {
      "clip_id": 3590,
      "title": "01-14-20 Regular Board Including Closed Session Items",
      "date": "2020-01-14",
      "time": "10:00 AM",
      "duration_seconds": 545,
      "duration_display": "9m 5s",
      "meeting_type": "Regular Board Meeting",
      "committee_name": null,
      "is_closed_session": true,
      "language": "English",
      "has_spanish_pair": false,
      "spanish_clip_id": null,
      "agenda_url": "https://lausd.granicus.com/AgendaViewer.php?view_id=4&clip_id=3590",
      "video_url": "https://lausd.granicus.com/MediaPlayer.php?view_id=4&clip_id=3590",
      "video_download_url": "https://lausd.granicus.com/DownloadFile.php?view_id=4&clip_id=3590",
      "status": "accessible",
      "agenda_items_noted": [
        "Opening Remarks",
        "Roll Call of Members",
        "Closed Session Items (Purpose and Authority)",
        "Student Discipline Matters (CA Education Code Section 48918)",
        "Recess into Closed Session",
        "Reconvene to Open Session",
        "Adjournment"
      ]
    },
    {
      "clip_id": 3591,
      "title": "01-14-20 Regular Board Meeting, 1:00 PM",
      "date": "2020-01-14",
      "time": "1:00 PM",
      "duration_seconds": 12947,
      "duration_display": "3h 35m",
      "meeting_type": "Regular Board Meeting",
      "committee_name": null,
      "is_closed_session": false,
      "language": "English",
      "has_spanish_pair": false,
      "spanish_clip_id": null,
      "agenda_url": "https://lausd.granicus.com/AgendaViewer.php?view_id=4&clip_id=3591",
      "video_url": "https://lausd.granicus.com/MediaPlayer.php?view_id=4&clip_id=3591",
      "video_download_url": "https://lausd.granicus.com/DownloadFile.php?view_id=4&clip_id=3591",
      "status": "accessible",
      "agenda_items_noted": [
        "Board reports",
        "Resolutions",
        "Procurement actions",
        "Financial audits"
      ]
    },
    {
      "clip_id": 3592,
      "title": "01-16-20 Legislative Advocacy Committee, 10:30 AM",
      "date": "2020-01-16",
      "time": "10:30 AM",
      "duration_seconds": 7145,
      "duration_display": "1h 59m",
      "meeting_type": "Committee",
      "committee_name": "Legislative Advocacy Committee",
      "is_closed_session": false,
      "language": "English",
      "has_spanish_pair": false,
      "spanish_clip_id": null,
      "agenda_url": "https://lausd.granicus.com/AgendaViewer.php?view_id=4&clip_id=3592",
      "video_url": "https://lausd.granicus.com/MediaPlayer.php?view_id=4&clip_id=3592",
      "video_download_url": "https://lausd.granicus.com/DownloadFile.php?view_id=4&clip_id=3592",
      "status": "accessible",
      "agenda_items_noted": [
        "Federal Appropriations for Fiscal Year 2020",
        "Governor's January Budget Proposal for FY 2020",
        "March 2020 Ballot Initiatives",
        "Closing Remarks",
        "Adjournment"
      ]
    },
    {
      "clip_id": 3593,
      "title": "01-16-20 Committee of the Whole Meeting, 4:00 PM",
      "date": "2020-01-16",
      "time": "4:00 PM",
      "duration_seconds": 8520,
      "duration_display": "2h 22m",
      "meeting_type": "Committee",
      "committee_name": "Committee of the Whole",
      "is_closed_session": false,
      "language": "English",
      "has_spanish_pair": false,
      "spanish_clip_id": null,
      "agenda_url": "https://lausd.granicus.com/AgendaViewer.php?view_id=4&clip_id=3593",
      "video_url": "https://lausd.granicus.com/MediaPlayer.php?view_id=4&clip_id=3593",
      "video_download_url": "https://lausd.granicus.com/DownloadFile.php?view_id=4&clip_id=3593",
      "status": "accessible",
      "agenda_items_noted": []
    },
    {
      "clip_id": 3594,
      "title": "01-21-20 Special Board Meeting Including Closed Session Items, 10:00 AM",
      "date": "2020-01-21",
      "time": "10:00 AM",
      "duration_seconds": 272,
      "duration_display": "4m 32s",
      "meeting_type": "Special Board Meeting",
      "committee_name": null,
      "is_closed_session": true,
      "language": "English",
      "has_spanish_pair": false,
      "spanish_clip_id": null,
      "agenda_url": "https://lausd.granicus.com/AgendaViewer.php?view_id=4&clip_id=3594",
      "video_url": "https://lausd.granicus.com/MediaPlayer.php?view_id=4&clip_id=3594",
      "video_download_url": "https://lausd.granicus.com/DownloadFile.php?view_id=4&clip_id=3594",
      "status": "accessible",
      "agenda_items_noted": [
        "Opening remarks",
        "Roll call",
        "Closed session items",
        "Recess/reconvene procedures",
        "Adjournment"
      ]
    },
    {
      "clip_id": 3595,
      "title": "01-21-20 Special Board Meeting Including Charter Items, 1:00 PM",
      "date": "2020-01-21",
      "time": "1:00 PM",
      "duration_seconds": 1342,
      "duration_display": "22m 22s",
      "meeting_type": "Special Board Meeting",
      "committee_name": null,
      "is_closed_session": false,
      "language": "English",
      "has_spanish_pair": false,
      "spanish_clip_id": null,
      "agenda_url": "https://lausd.granicus.com/AgendaViewer.php?view_id=4&clip_id=3595",
      "video_url": "https://lausd.granicus.com/MediaPlayer.php?view_id=4&clip_id=3595",
      "video_download_url": "https://lausd.granicus.com/DownloadFile.php?view_id=4&clip_id=3595",
      "status": "accessible",
      "agenda_items_noted": [
        "Roll Call and Pledge of Allegiance",
        "Rep-219-19/20: Proposition 39 Charter Facilities Compliance for 2020-2021",
        "Rep-217-19/20: Libertas College Preparatory Charter enrollment capacity increase approval"
      ]
    },
    {
      "clip_id": 3596,
      "title": "[Restricted - likely Closed Session, late January 2020]",
      "date": "2020-01-21",
      "time": null,
      "duration_seconds": null,
      "duration_display": null,
      "meeting_type": "Unknown (Restricted)",
      "committee_name": null,
      "is_closed_session": true,
      "language": "English",
      "has_spanish_pair": false,
      "spanish_clip_id": null,
      "agenda_url": null,
      "video_url": "https://lausd.granicus.com/MediaPlayer.php?view_id=4&clip_id=3596",
      "video_download_url": null,
      "status": "restricted_403",
      "agenda_items_noted": [],
      "notes": "Returns HTTP 403. Agenda unpublished. Between clip 3595 (Jan 21) and 3597 (Jan 28). Likely a closed session from late January 2020."
    },
    {
      "clip_id": 3597,
      "title": "01-28-20 Continuous Improvement Data Committee, 10:30 AM",
      "date": "2020-01-28",
      "time": "10:30 AM",
      "duration_seconds": 7860,
      "duration_display": "2h 11m",
      "meeting_type": "Committee",
      "committee_name": "Continuous Improvement Data Committee",
      "is_closed_session": false,
      "language": "English",
      "has_spanish_pair": false,
      "spanish_clip_id": null,
      "agenda_url": "https://lausd.granicus.com/AgendaViewer.php?view_id=4&clip_id=3597",
      "video_url": "https://lausd.granicus.com/MediaPlayer.php?view_id=4&clip_id=3597",
      "video_download_url": "https://lausd.granicus.com/DownloadFile.php?view_id=4&clip_id=3597",
      "status": "accessible",
      "agenda_items_noted": []
    },
    {
      "clip_id": 3598,
      "title": "01-28-20 Curriculum, Instruction, and Assessment Committee, 1:00 PM",
      "date": "2020-01-28",
      "time": "1:00 PM",
      "duration_seconds": 9960,
      "duration_display": "2h 46m",
      "meeting_type": "Committee",
      "committee_name": "Curriculum, Instruction, and Assessment Committee",
      "is_closed_session": false,
      "language": "English",
      "has_spanish_pair": false,
      "spanish_clip_id": null,
      "agenda_url": "https://lausd.granicus.com/AgendaViewer.php?view_id=4&clip_id=3598",
      "video_url": "https://lausd.granicus.com/MediaPlayer.php?view_id=4&clip_id=3598",
      "video_download_url": "https://lausd.granicus.com/DownloadFile.php?view_id=4&clip_id=3598",
      "status": "accessible",
      "agenda_items_noted": []
    },
    {
      "clip_id": 3600,
      "title": "02-04-20 Regular Board Meeting Including Closed Session Items, 10:00 AM",
      "date": "2020-02-04",
      "time": "10:00 AM",
      "duration_seconds": 385,
      "duration_display": "6m 25s",
      "meeting_type": "Regular Board Meeting",
      "committee_name": null,
      "is_closed_session": true,
      "language": "English",
      "has_spanish_pair": false,
      "spanish_clip_id": null,
      "agenda_url": "https://lausd.granicus.com/AgendaViewer.php?view_id=4&clip_id=3600",
      "video_url": "https://lausd.granicus.com/MediaPlayer.php?view_id=4&clip_id=3600",
      "video_download_url": "https://lausd.granicus.com/DownloadFile.php?view_id=4&clip_id=3600",
      "status": "accessible",
      "agenda_items_noted": [
        "Opening Remarks",
        "Closed Session Items",
        "Personnel Discussion (Government Code Section 54957)",
        "Adjournment"
      ]
    },
    {
      "clip_id": 3601,
      "title": "02-04-20 Regular Board of Education Meeting, 1:00 PM",
      "date": "2020-02-04",
      "time": "1:00 PM",
      "duration_seconds": 13680,
      "duration_display": "3h 48m",
      "meeting_type": "Regular Board Meeting",
      "committee_name": null,
      "is_closed_session": false,
      "language": "English",
      "has_spanish_pair": false,
      "spanish_clip_id": null,
      "agenda_url": "https://lausd.granicus.com/AgendaViewer.php?view_id=4&clip_id=3601",
      "video_url": "https://lausd.granicus.com/MediaPlayer.php?view_id=4&clip_id=3601",
      "video_download_url": "https://lausd.granicus.com/DownloadFile.php?view_id=4&clip_id=3601",
      "status": "accessible",
      "agenda_items_noted": [
        "Superintendent reports",
        "Facilities contracts",
        "Information technology initiatives",
        "Bond issuance approvals"
      ]
    },
    {
      "clip_id": 3602,
      "title": "02-06-2020 Committee of the Whole, 4:00 PM",
      "date": "2020-02-06",
      "time": "4:00 PM",
      "duration_seconds": 10320,
      "duration_display": "2h 52m",
      "meeting_type": "Committee",
      "committee_name": "Committee of the Whole",
      "is_closed_session": false,
      "language": "English",
      "has_spanish_pair": false,
      "spanish_clip_id": null,
      "agenda_url": "https://lausd.granicus.com/AgendaViewer.php?view_id=4&clip_id=3602",
      "video_url": "https://lausd.granicus.com/MediaPlayer.php?view_id=4&clip_id=3602",
      "video_download_url": "https://lausd.granicus.com/DownloadFile.php?view_id=4&clip_id=3602",
      "status": "accessible",
      "agenda_items_noted": []
    },
    {
      "clip_id": 3603,
      "title": "02-11-20 Curriculum, Instruction, and Assessment Committee, 10:00 AM",
      "date": "2020-02-11",
      "time": "10:00 AM",
      "duration_seconds": 8640,
      "duration_display": "2h 24m",
      "meeting_type": "Committee",
      "committee_name": "Curriculum, Instruction, and Assessment Committee",
      "is_closed_session": false,
      "language": "English",
      "has_spanish_pair": false,
      "spanish_clip_id": null,
      "agenda_url": "https://lausd.granicus.com/AgendaViewer.php?view_id=4&clip_id=3603",
      "video_url": "https://lausd.granicus.com/MediaPlayer.php?view_id=4&clip_id=3603",
      "video_download_url": "https://lausd.granicus.com/DownloadFile.php?view_id=4&clip_id=3603",
      "status": "accessible",
      "agenda_items_noted": []
    },
    {
      "clip_id": 3604,
      "title": "02-13-20 Early Childhood Education Committee, 10:30 AM",
      "date": "2020-02-13",
      "time": "10:30 AM",
      "duration_seconds": 7986,
      "duration_display": "2h 13m",
      "meeting_type": "Committee",
      "committee_name": "Early Childhood Education Committee",
      "is_closed_session": false,
      "language": "English",
      "has_spanish_pair": false,
      "spanish_clip_id": null,
      "agenda_url": "https://lausd.granicus.com/AgendaViewer.php?view_id=4&clip_id=3604",
      "video_url": "https://lausd.granicus.com/MediaPlayer.php?view_id=4&clip_id=3604",
      "video_download_url": "https://lausd.granicus.com/DownloadFile.php?view_id=4&clip_id=3604",
      "status": "accessible",
      "agenda_items_noted": [
        "Welcome and Introductions",
        "Governor's January Budget Proposal for Fiscal Year 2020",
        "Professional Development for Early Childhood Educators",
        "Closing Remarks",
        "Adjournment"
      ]
    },
    {
      "clip_id": 3605,
      "title": "02-18-20 Regular Board Meeting Including Closed Session Items, 10:00 AM",
      "date": "2020-02-18",
      "time": "10:00 AM",
      "duration_seconds": 1941,
      "duration_display": "32m 21s",
      "meeting_type": "Regular Board Meeting",
      "committee_name": null,
      "is_closed_session": true,
      "language": "English",
      "has_spanish_pair": false,
      "spanish_clip_id": null,
      "agenda_url": "https://lausd.granicus.com/AgendaViewer.php?view_id=4&clip_id=3605",
      "video_url": "https://lausd.granicus.com/MediaPlayer.php?view_id=4&clip_id=3605",
      "video_download_url": "https://lausd.granicus.com/DownloadFile.php?view_id=4&clip_id=3605",
      "status": "accessible",
      "agenda_items_noted": [
        "Opening Remarks",
        "Roll Call",
        "Closed Session Items",
        "Public Comment",
        "Recess/Reconvene",
        "Adjournment"
      ]
    },
    {
      "clip_id": 3606,
      "title": "[Restricted - inferred: 02-18-20 Regular Board Meeting, 1:00 PM]",
      "date": "2020-02-18",
      "time": "1:00 PM",
      "duration_seconds": null,
      "duration_display": null,
      "meeting_type": "Regular Board Meeting",
      "committee_name": null,
      "is_closed_session": false,
      "language": "English",
      "has_spanish_pair": false,
      "spanish_clip_id": null,
      "agenda_url": null,
      "video_url": "https://lausd.granicus.com/MediaPlayer.php?view_id=4&clip_id=3606",
      "video_download_url": null,
      "status": "restricted_403",
      "agenda_items_noted": [],
      "notes": "Returns HTTP 403. No agenda published. Chronologically between clip 3605 (Feb 18 morning closed session) and clip 3607 (Feb 20 Parent Engagement). LAUSD Regular Board Meetings consistently have a morning closed session followed by an afternoon open session. This is very likely the Feb 18, 2020 Regular Board Meeting afternoon session."
    },
    {
      "clip_id": 3607,
      "title": "02-20-20 Parent Engagement Committee, 4:00 PM",
      "date": "2020-02-20",
      "time": "4:00 PM",
      "duration_seconds": 11667,
      "duration_display": "3h 14m",
      "meeting_type": "Committee",
      "committee_name": "Parent Engagement Committee",
      "is_closed_session": false,
      "language": "English",
      "has_spanish_pair": false,
      "spanish_clip_id": null,
      "agenda_url": "https://lausd.granicus.com/AgendaViewer.php?view_id=4&clip_id=3607",
      "video_url": "https://lausd.granicus.com/MediaPlayer.php?view_id=4&clip_id=3607",
      "video_download_url": "https://lausd.granicus.com/DownloadFile.php?view_id=4&clip_id=3607",
      "status": "accessible",
      "agenda_items_noted": [
        "Parents as Partners",
        "Cultivating Partnership between the Home and School: Parent & Family Center Leadership",
        "We Are One: Make Los Angeles Unified Count in Census 2020",
        "Public Comment",
        "Adjournment"
      ]
    },
    {
      "clip_id": 3612,
      "title": "03-05-20 Special Closed Session Board of Education, 2:30 PM",
      "date": "2020-03-05",
      "time": "2:30 PM",
      "duration_seconds": 261,
      "duration_display": "4m 21s",
      "meeting_type": "Special Board Meeting",
      "committee_name": null,
      "is_closed_session": true,
      "language": "English",
      "has_spanish_pair": false,
      "spanish_clip_id": null,
      "agenda_url": "https://lausd.granicus.com/AgendaViewer.php?view_id=4&clip_id=3612",
      "video_url": "https://lausd.granicus.com/MediaPlayer.php?view_id=4&clip_id=3612",
      "video_download_url": "https://lausd.granicus.com/DownloadFile.php?view_id=4&clip_id=3612",
      "status": "accessible",
      "agenda_items_noted": [
        "Roll Call of Members",
        "Closed Session Items (Purpose and Authority)",
        "Recess into Closed Session",
        "Reconvene to Open Session",
        "Adjournment"
      ]
    },
    {
      "clip_id": 3613,
      "title": "03-05-20 Committee of the Whole, 4:00 PM",
      "date": "2020-03-05",
      "time": "4:00 PM",
      "duration_seconds": 11040,
      "duration_display": "3h 4m",
      "meeting_type": "Committee",
      "committee_name": "Committee of the Whole",
      "is_closed_session": false,
      "language": "English",
      "has_spanish_pair": false,
      "spanish_clip_id": null,
      "agenda_url": "https://lausd.granicus.com/AgendaViewer.php?view_id=4&clip_id=3613",
      "video_url": "https://lausd.granicus.com/MediaPlayer.php?view_id=4&clip_id=3613",
      "video_download_url": "https://lausd.granicus.com/DownloadFile.php?view_id=4&clip_id=3613",
      "status": "accessible",
      "agenda_items_noted": []
    },
    {
      "clip_id": 3614,
      "title": "03-10-20 Regular Board Meeting Including Closed Session Items, 10:00 AM",
      "date": "2020-03-10",
      "time": "10:00 AM",
      "duration_seconds": 947,
      "duration_display": "15m 47s",
      "meeting_type": "Regular Board Meeting",
      "committee_name": null,
      "is_closed_session": true,
      "language": "English",
      "has_spanish_pair": false,
      "spanish_clip_id": null,
      "agenda_url": "https://lausd.granicus.com/AgendaViewer.php?view_id=4&clip_id=3614",
      "video_url": "https://lausd.granicus.com/MediaPlayer.php?view_id=4&clip_id=3614",
      "video_download_url": "https://lausd.granicus.com/DownloadFile.php?view_id=4&clip_id=3614",
      "status": "accessible",
      "agenda_items_noted": [
        "Opening Remarks",
        "Roll Call",
        "Closed Session Items",
        "Adjournment"
      ]
    },
    {
      "clip_id": 3615,
      "title": "03-10-20 Regular Board of Education Meeting, 1:00 PM",
      "date": "2020-03-10",
      "time": "1:00 PM",
      "duration_seconds": 13374,
      "duration_display": "3h 43m",
      "meeting_type": "Regular Board Meeting",
      "committee_name": null,
      "is_closed_session": false,
      "language": "English",
      "has_spanish_pair": false,
      "spanish_clip_id": null,
      "agenda_url": "https://lausd.granicus.com/AgendaViewer.php?view_id=4&clip_id=3615",
      "video_url": "https://lausd.granicus.com/MediaPlayer.php?view_id=4&clip_id=3615",
      "video_download_url": "https://lausd.granicus.com/DownloadFile.php?view_id=4&clip_id=3615",
      "status": "accessible",
      "agenda_items_noted": [
        "Opening remarks",
        "Roll call",
        "Superintendent reports - TK-8 mathematics textbook adoption",
        "COVID-19 updates",
        "Committee chair reports",
        "Consent items - procurement actions, personnel matters, budget reports"
      ]
    },
    {
      "clip_id": 3616,
      "title": "03-10-20 Special Board Meeting - Emergency Declaration (COVID-19), 5:00 PM",
      "date": "2020-03-10",
      "time": "5:00 PM",
      "duration_seconds": 2209,
      "duration_display": "36m 49s",
      "meeting_type": "Special Board Meeting",
      "committee_name": null,
      "is_closed_session": false,
      "language": "English",
      "has_spanish_pair": false,
      "spanish_clip_id": null,
      "agenda_url": "https://lausd.granicus.com/AgendaViewer.php?view_id=4&clip_id=3616",
      "video_url": "https://lausd.granicus.com/MediaPlayer.php?view_id=4&clip_id=3616",
      "video_download_url": "https://lausd.granicus.com/DownloadFile.php?view_id=4&clip_id=3616",
      "status": "accessible",
      "agenda_items_noted": [
        "Authorization to Take Any and All Necessary Actions to Prepare and Respond Effectively to the Novel Coronavirus (COVID-19)",
        "Resolution declaring emergency conditions at the district"
      ]
    },
    {
      "clip_id": 3617,
      "title": "03-13-20 Closed Session Board of Education, Part 1 Open Meeting, 7:00 AM",
      "date": "2020-03-13",
      "time": "7:00 AM",
      "duration_seconds": 651,
      "duration_display": "10m 51s",
      "meeting_type": "Special Board Meeting",
      "committee_name": null,
      "is_closed_session": true,
      "language": "English",
      "has_spanish_pair": false,
      "spanish_clip_id": null,
      "agenda_url": "https://lausd.granicus.com/AgendaViewer.php?view_id=4&clip_id=3617",
      "video_url": "https://lausd.granicus.com/MediaPlayer.php?view_id=4&clip_id=3617",
      "video_download_url": "https://lausd.granicus.com/DownloadFile.php?view_id=4&clip_id=3617",
      "status": "accessible",
      "agenda_items_noted": [
        "Roll call",
        "Pledge of allegiance",
        "Open session items",
        "Public comment period",
        "Closed session proceedings"
      ]
    },
    {
      "clip_id": 3618,
      "title": "03-13-20 Emergency Board Meeting, 7:00 AM Part 2 Reconvene",
      "date": "2020-03-13",
      "time": "7:00 AM",
      "duration_seconds": 76,
      "duration_display": "1m 16s",
      "meeting_type": "Emergency Board Meeting",
      "committee_name": null,
      "is_closed_session": false,
      "language": "English",
      "has_spanish_pair": false,
      "spanish_clip_id": null,
      "agenda_url": "https://lausd.granicus.com/AgendaViewer.php?view_id=4&clip_id=3618",
      "video_url": "https://lausd.granicus.com/MediaPlayer.php?view_id=4&clip_id=3618",
      "video_download_url": "https://lausd.granicus.com/DownloadFile.php?view_id=4&clip_id=3618",
      "status": "accessible",
      "agenda_items_noted": [
        "Reconvene to Open Session",
        "Adjournment"
      ]
    },
    {
      "clip_id": 3619,
      "title": "03-13-20 Special Closed Session Board of Education, 1:00 PM",
      "date": "2020-03-13",
      "time": "1:00 PM",
      "duration_seconds": 528,
      "duration_display": "8m 48s",
      "meeting_type": "Special Board Meeting",
      "committee_name": null,
      "is_closed_session": true,
      "language": "English",
      "has_spanish_pair": false,
      "spanish_clip_id": null,
      "agenda_url": "https://lausd.granicus.com/AgendaViewer.php?view_id=4&clip_id=3619",
      "video_url": "https://lausd.granicus.com/MediaPlayer.php?view_id=4&clip_id=3619",
      "video_download_url": "https://lausd.granicus.com/DownloadFile.php?view_id=4&clip_id=3619",
      "status": "accessible",
      "agenda_items_noted": [
        "Roll Call of Members",
        "Closed Session Items (Purpose and Authority)",
        "A Threat to Public Services or Facilities (Government Code Section 54957)",
        "Personnel (Government Code Section 54957)",
        "Public Speakers",
        "Recess into Closed Session",
        "Reconvene to Open Session",
        "Adjournment"
      ]
    },
    {
      "clip_id": 3636,
      "title": "03-31-20 Closed Session Board of Education, 10:00 AM",
      "date": "2020-03-31",
      "time": "10:00 AM",
      "duration_seconds": 1920,
      "duration_display": "32m",
      "meeting_type": "Special Board Meeting",
      "committee_name": null,
      "is_closed_session": true,
      "language": "English",
      "has_spanish_pair": false,
      "spanish_clip_id": null,
      "agenda_url": "https://lausd.granicus.com/AgendaViewer.php?view_id=4&clip_id=3636",
      "video_url": "https://lausd.granicus.com/MediaPlayer.php?view_id=4&clip_id=3636",
      "video_download_url": "https://lausd.granicus.com/DownloadFile.php?view_id=4&clip_id=3636",
      "status": "accessible",
      "agenda_items_noted": [],
      "notes": "Agenda PDF title: '03-31-20SpclBdCSOBPost.doc'. This is the last Q1 2020 meeting found."
    }
  ],
  "summary": {
    "meetings_by_type": {
      "Regular Board Meeting": 8,
      "Special Board Meeting": 7,
      "Emergency Board Meeting": 1,
      "Committee": 10,
      "Unknown (Restricted)": 1
    },
    "meetings_by_month": {
      "January 2020": 10,
      "February 2020": 8,
      "March 2020": 9
    },
    "committee_types_found": [
      "Special Education Committee",
      "Legislative Advocacy Committee",
      "Committee of the Whole",
      "Continuous Improvement Data Committee",
      "Curriculum, Instruction, and Assessment Committee",
      "Early Childhood Education Committee",
      "Parent Engagement Committee"
    ],
    "notable_meetings": [
      {
        "clip_id": 3616,
        "title": "03-10-20 Special Board Meeting - Emergency Declaration (COVID-19), 5:00 PM",
        "significance": "Board adopted resolution declaring emergency conditions and authorized COVID-19 response actions"
      },
      {
        "clip_id": 3617,
        "title": "03-13-20 Closed Session Board of Education, Part 1, 7:00 AM",
        "significance": "Emergency early-morning meeting likely related to COVID-19 school closure decision (LAUSD closed schools March 16, 2020)"
      },
      {
        "clip_id": 3618,
        "title": "03-13-20 Emergency Board Meeting, Part 2 Reconvene",
        "significance": "Reconvene after emergency closed session, only 76 seconds long"
      }
    ],
    "covid_impact_notes": "COVID-19 significantly disrupted LAUSD board operations in March 2020. The board held an emergency declaration meeting on March 10, emergency closed sessions on March 13 (7 AM), and a special closed session on March 13 (1 PM). LAUSD schools closed March 16, 2020. No committee meetings appear after March 5, 2020. The March 31 meeting was a closed session only. The regular March 24 board meeting (which would have been the second regular meeting of the month) does not appear in the archive, likely cancelled due to COVID.",
    "bilingual_notes": "Unlike current LAUSD Granicus entries (2023-2025) which are posted in English/Spanish pairs with separate clip_ids, Q1 2020 meetings are English-only with no Spanish paired entries.",
    "restricted_clips_in_range": {
      "3596": "HTTP 403, between Jan 21 and Jan 28 - likely closed session",
      "3606": "HTTP 403, between Feb 18 morning and Feb 20 - likely Feb 18 afternoon Regular Board Meeting",
      "3611": "HTTP 403, between Feb 20 (or later) and Mar 5 - date unknown",
      "3622": "HTTP 403, post Mar 13 - date unknown, could be March 2020",
      "3623": "HTTP 403, post Mar 13 - date unknown, could be March 2020",
      "3625": "HTTP 403, post Mar 13 - date unknown, could be March 2020",
      "3631": "HTTP 403, between Mar 13 and Mar 31 - date unknown",
      "3632": "HTTP 403, between Mar 13 and Mar 31 - date unknown",
      "3633": "HTTP 403, between Mar 13 and Mar 31 - date unknown",
      "3634": "HTTP 403, between Mar 13 and Mar 31 - date unknown",
      "3635": "HTTP 403, between Mar 13 and Mar 31 - date unknown",
      "3637": "HTTP 403, after Mar 31 - likely April 2020",
      "3638": "HTTP 403, after Mar 31 - likely April 2020"
    },
    "missing_clip_ids_404": [3599, 3608, 3609, 3610, 3620, 3621, 3624, 3626, 3627, 3628, 3629, 3630]
  }
}
